<?xml version="1.0" encoding="UTF-8"?>
<list xmlns:xsi="http://www.w3.org/2001/XMLSchema-instance" xsi:noNamespaceSchemaLocation="../../xsd/items.xsd">
    <item id="10000" type="STRUCTURE" nameId="asti1" rank="A" buildTime="60" descriptionId="asti1_d">
        <requirement>
            <item id="metal" count="50" />
        </requirement>
        <properties>
            <set name="slot_cargo" value="0" />
            <set name="slot_engine" value="1" />
            <set name="slot_module" value="1" />
            <set name="slot_technology" value="1" />
            <set name="slot_weapon" value="0" />
        </properties>
    </item>
    <item id="10001" type="STRUCTURE" nameId="asti2" rank="B" buildTime="60" descriptionId="asti2_d">
        <requirement>
            <item id="metal" count="100" />
        </requirement>
        <properties>
            <set name="slot_cargo" value="1" />
            <set name="slot_engine" value="1" />
            <set name="slot_module" value="2" />
            <set name="slot_technology" value="2" />
            <set name="slot_weapon" value="1" />
        </properties>
    </item>
    <item id="10002" type="STRUCTURE" nameId="asti3" rank="C" buildTime="60" descriptionId="asti3_d">
        <requirement>
            <item id="metal" count="275" />
        </requirement>
        <properties>
            <set name="slot_cargo" value="2" />
            <set name="slot_engine" value="2" />
            <set name="slot_module" value="2" />
            <set name="slot_technology" value="2" />
            <set name="slot_weapon" value="2" />
        </properties>
    </item>
    <item id="10003" type="STRUCTURE" nameId="asti4" rank="D" buildTime="60" descriptionId="asti4_d">
        <requirement>
            <item id="metal" count="600" />
        </requirement>
        <properties>
            <set name="slot_cargo" value="4" />
            <set name="slot_engine" value="4" />
            <set name="slot_module" value="3" />
            <set name="slot_technology" value="2" />
            <set name="slot_weapon" value="4" />
        </properties>
    </item>
    <item id="10004" type="STRUCTURE" nameId="asti5" rank="E" buildTime="60" descriptionId="asti5_d">
        <requirement>
            <item id="metal" count="1000" />
        </requirement>
        <properties>
            <set name="slot_cargo" value="10" />
            <set name="slot_engine" value="6" />
            <set name="slot_module" value="4" />
            <set name="slot_technology" value="4" />
            <set name="slot_weapon" value="8" />
        </properties>
    </item>
</list>