<?xml version="1.0" encoding="UTF-8"?>
<list xmlns:xsi="http://www.w3.org/2001/XMLSchema-instance" xsi:noNamespaceSchemaLocation="../../xsd/items.xsd">
    <item id="resource_1" type="RESOURCE" nameId="resource_1_n" descriptionId="resource_1_d" volume="1" rarity="1"/>
    <item id="resource_2" type="RESOURCE" nameId="resource_2_n" descriptionId="resource_2_d" volume="1" rarity="1"/>
    <item id="resource_3" type="RESOURCE" nameId="resource_3_n" descriptionId="resource_3_d" volume="1" rarity="3"/>
    <item id="resource_4" type="RESOURCE" nameId="resource_4_n" descriptionId="resource_4_d" volume="1" rarity="2"/>
    <item id="resource_5" type="RESOURCE" nameId="resource_5_n" descriptionId="resource_5_d" volume="1" rarity="2"/>
    <item id="resource_steel" type="COMMON" nameId="resource_steel_n" descriptionId="resource_steel_d" volume="1">
        <requirements>
            <item id="resource_1" count="100"/>
            <item id="resource_2" count="100"/>
        </requirements>
    </item>
    <item id="resource_plastic" type="COMMON" nameId="resource_plastic_n" descriptionId="resource_plastic_d" volume="1">
        <requirements>
            <item id="resource_4" count="100"/>
        </requirements>
    </item>
    <item id="resource_tool" type="COMMON" nameId="resource_tool_n" descriptionId="resource_tool_d" volume="1">
        <requirements>
            <item id="resource_steel" count="100"/>
            <item id="resource_plastic" count="100"/>
        </requirements>
    </item>
    <item id="resource_nanoliquid" type="COMMON" nameId="resource_nanoliquid_n" descriptionId="resource_nanoliquid_d"
          volume="1">
        <requirements>
            <item id="resource_3" count="75"/>
            <item id="resource_4" count="30"/>
            <item id="resource_5" count="60"/>
        </requirements>
    </item>
    <item id="resource_septum" type="COMMON" nameId="resource_septum_n" descriptionId="resource_septum_d" volume="1">
        <requirements>
            <item id="resource_nanoliquid" count="100"/>
        </requirements>
    </item>
</list>