<?xml version="1.0" encoding="UTF-8"?>
<list xmlns:xsi="http://www.w3.org/2001/XMLSchema-instance" xsi:noNamespaceSchemaLocation="../../xsd/items.xsd">
    <!-- Resources Optimizers -->
    <item id="module_optimizer_feo" nameId="module_optimizer_feo_n" type="MODULE" descriptionId="module_optimizer_feo_d" volume="1">
        <stats>
            <set stat="RESOURCE_FEO" op="PER" value="1.25" />
        </stats>
        <requirements>
            <item id="resource_feo" count="100" />
            <item id="resource_h2o" count="100" />
            <item id="resource_c" count="100" />
        </requirements>
    </item>
    <item id="module_optimizer_c" nameId="module_optimizer_c_n" type="MODULE" descriptionId="module_optimizer_c_d" volume="1">
        <stats>
            <set stat="RESOURCE_C" op="PER" value="1.25" />
        </stats>
        <requirements>
            <item id="resource_feo" count="100" />
            <item id="resource_h2o" count="100" />
            <item id="resource_c" count="100" />
        </requirements>
    </item>
    <item id="module_optimizer_ato3" nameId="module_optimizer_ato3_n" type="MODULE" descriptionId="module_optimizer_ato3_d" volume="1">
        <stats>
            <set stat="RESOURCE_ATO3" op="PER" value="1.25" />
        </stats>
        <requirements>
            <item id="resource_feo" count="100" />
            <item id="resource_h2o" count="100" />
            <item id="resource_c" count="100" />
        </requirements>
    </item>
    <item id="module_optimizer_ch4" nameId="module_optimizer_ch4_n" type="MODULE" descriptionId="module_optimizer_ch4_d" volume="1">
        <stats>
            <set stat="RESOURCE_CH4" op="PER" value="1.25" />
        </stats>
        <requirements>
            <item id="resource_feo" count="100" />
            <item id="resource_h2o" count="100" />
            <item id="resource_c" count="100" />
        </requirements>
    </item>
    <item id="module_optimizer_h2o" nameId="module_optimizer_h2o_n" type="MODULE" descriptionId="module_optimizer_h2o_d" volume="1">
        <stats>
            <set stat="RESOURCE_H2O" op="PER" value="1.25" />
        </stats>
        <requirements>
            <item id="resource_feo" count="100" />
            <item id="resource_h2o" count="100" />
            <item id="resource_c" count="100" />
        </requirements>
    </item>
    <!-- Silo specialization -->
    <item id="module_silo_improve_feo" nameId="module_silo_improve_feo_n" type="MODULE" descriptionId="module_silo_improve_feo_d" >
        <properties>
            <set name="unlock_stat" value="MAX_RESOURCE_FEO"/>
        </properties>
    </item>
    <item id="module_silo_improve_c" nameId="module_silo_improve_c_n" type="MODULE" descriptionId="module_silo_improve_c_d" >
        <properties>
            <set name="unlock_stat" value="MAX_RESOURCE_C"/>
        </properties>
    </item>
    <item id="module_silo_improve_ato3" nameId="module_silo_improve_ato3_n" type="MODULE" descriptionId="module_silo_improve_ato3_d" >
        <properties>
            <set name="unlock_stat" value="MAX_RESOURCE_ATO3"/>
        </properties>
    </item>
    <item id="module_silo_improve_ch4" nameId="module_silo_improve_ch4_n" type="MODULE" descriptionId="module_silo_improve_ch4_d" >
        <properties>
            <set name="unlock_stat" value="MAX_RESOURCE_CH4"/>
        </properties>
    </item>
    <item id="module_silo_improve_h2o" nameId="module_silo_improve_h2o_n" type="MODULE" descriptionId="module_silo_improve_h2o_d" >
        <properties>
            <set name="unlock_stat" value="MAX_RESOURCE_H2O"/>
        </properties>
    </item>
    <!-- Building Specializations -->
    <item id="module_building_factory_structure" nameId="module_building_factory_structure_n" type="MODULE" descriptionId="module_building_factory_structure_d" />
    <item id="module_building_factory_engine" nameId="module_building_factory_engine_n" type="MODULE" descriptionId="module_building_factory_engine_d" />
    <item id="module_building_factory_cargo" nameId="module_building_factory_cargo_n" type="MODULE" descriptionId="module_building_factory_cargo_d" />
    <item id="module_building_factory_weapon" nameId="module_building_factory_weapon_n" type="MODULE" descriptionId="module_building_factory_weapon_d" />
    <item id="module_building_factory_rafinery" nameId="module_building_factory_rafinery_n" type="MODULE" descriptionId="module_building_factory_rafinery_d" />
    <item id="module_building_shield_laser" nameId="module_building_shield_laser_n" type="MODULE" descriptionId="module_building_shield_laser_d">
        <properties>
            <set name="shield_defense" value="technology_laser"/>
        </properties>
    </item>
    <item id="module_building_shield_ion" nameId="module_building_shield_ion_n" type="MODULE" descriptionId="module_building_shield_ion_d">
        <properties>
            <set name="shield_defense" value="technology_ion"/>
        </properties>
    </item>
    <item id="module_building_shield_photon" nameId="module_building_shield_photon_n" type="MODULE" descriptionId="module_building_shield_photon_d">
        <properties>
            <set name="shield_defense" value="technology_photon"/>
        </properties>
    </item>
    <item id="module_building_shield_plasma" nameId="module_building_shield_plasma_n" type="MODULE" descriptionId="module_building_shield_plasma_d">
        <properties>
            <set name="shield_defense" value="technology_plasma"/>
        </properties>
    </item>
    <item id="module_building_shield_graviton" nameId="module_building_shield_graviton_n" type="MODULE" descriptionId="module_building_shield_graviton_d">
        <properties>
            <set name="shield_defense" value="technology_graviton"/>
        </properties>
    </item>
</list>